id,score,href,fields_title
3823259,6.052657,https://api.reliefweb.int/v1/reports/3823259?appname=DESKTOP-06R1BSH,"Ukraine - Ongoing hostilities (DG ECHO, UN OCHA) (ECHO Daily Flash of 03 March 2022)"
3821589,6.052657,https://api.reliefweb.int/v1/reports/3821589?appname=DESKTOP-06R1BSH,World NGO day: Statement by the High Representative/Vice-President Josep Borrell
3821295,6.052657,https://api.reliefweb.int/v1/reports/3821295?appname=DESKTOP-06R1BSH,CARICOM statement on the situation in Ukraine
3829032,6.052657,https://api.reliefweb.int/v1/reports/3829032?appname=DESKTOP-06R1BSH,"Statement on racial discrimination against persons fleeing from the armed conflict in Ukraine, Statement 1 (2022)"
3823755,6.052657,https://api.reliefweb.int/v1/reports/3823755?appname=DESKTOP-06R1BSH,Ukraine: Council unanimously introduces temporary protection for persons fleeing the war
3826433,6.052657,https://api.reliefweb.int/v1/reports/3826433?appname=DESKTOP-06R1BSH,Kazakhstan announces the volume of humanitarian aid for Ukraine
3824628,6.052657,https://api.reliefweb.int/v1/reports/3824628?appname=DESKTOP-06R1BSH,UAE sends 30 tonne emergency medical and relief aid to Ukraine
3822110,6.052657,https://api.reliefweb.int/v1/reports/3822110?appname=DESKTOP-06R1BSH,Ministry of the Interior and Administration: Information on the stay in Poland of persons fleeing from Ukraine [EN/UK]
3821707,6.052657,https://api.reliefweb.int/v1/reports/3821707?appname=DESKTOP-06R1BSH,Minister Liesje Schreinemacher has made €20 million available for the victims of the war in Ukraine
3826734,6.052657,https://api.reliefweb.int/v1/reports/3826734?appname=DESKTOP-06R1BSH,Signing and Exchange of Notes for the Grant of JSDF Equipment and Goods to Ukraine
3825310,6.052657,https://api.reliefweb.int/v1/reports/3825310?appname=DESKTOP-06R1BSH,Estonia to simplify process of taking in Ukrainian refugees [EN/RU]
3822756,6.052657,https://api.reliefweb.int/v1/reports/3822756?appname=DESKTOP-06R1BSH,Government allocates 1.3 million euros to cover critical costs of Ukrainian refugees
3831471,6.052657,https://api.reliefweb.int/v1/reports/3831471?appname=DESKTOP-06R1BSH,More vital medicines from UK arrive in Ukraine
3829653,6.052657,https://api.reliefweb.int/v1/reports/3829653?appname=DESKTOP-06R1BSH,UK donates 3.7 million medical items to Ukraine
3822022,6.052657,https://api.reliefweb.int/v1/reports/3822022?appname=DESKTOP-06R1BSH,PM announces further humanitarian aid to Ukraine
3822765,6.052657,https://api.reliefweb.int/v1/reports/3822765?appname=DESKTOP-06R1BSH,Switzerland sends humanitarian aid to Ukrainian population
3822115,6.052657,https://api.reliefweb.int/v1/reports/3822115?appname=DESKTOP-06R1BSH,Ministry of Internal Affairs Press release 27 February 2022
3826641,6.052657,https://api.reliefweb.int/v1/reports/3826641?appname=DESKTOP-06R1BSH,Govt Donates 2 Million Baht for Humanitarian Assistance in Ukraine
3826296,6.052657,https://api.reliefweb.int/v1/reports/3826296?appname=DESKTOP-06R1BSH,"Statement by GCPEA Executive Director, Diya Nijhowne, on Attacks on Education in Ukraine"
3823706,6.052657,https://api.reliefweb.int/v1/reports/3823706?appname=DESKTOP-06R1BSH,Ukraine Casualty Monitor: AOAV data on harm to civilians by explosive weapons
3822733,6.052657,https://api.reliefweb.int/v1/reports/3822733?appname=DESKTOP-06R1BSH,Ukraine: AOAV’s conflict briefing
3822746,6.052657,https://api.reliefweb.int/v1/reports/3822746?appname=DESKTOP-06R1BSH,FCA grants its first euro 1/2 million grant to aid Ukrainians affected by the conflict
3829464,6.052657,https://api.reliefweb.int/v1/reports/3829464?appname=DESKTOP-06R1BSH,"Almost 10 million people displaced and 12 million stranded in Ukraine need urgent humanitarian assistance, warns IRC"
3827171,6.052657,https://api.reliefweb.int/v1/reports/3827171?appname=DESKTOP-06R1BSH,"Ukraine Crisis - Situation Report #5 (March 14, 2022)"
3826088,6.052657,https://api.reliefweb.int/v1/reports/3826088?appname=DESKTOP-06R1BSH,"Ukraine Crisis - Situation Report #4 (March 10, 2022)"
3823025,6.052657,https://api.reliefweb.int/v1/reports/3823025?appname=DESKTOP-06R1BSH,"Ukraine Crisis - Situation Report #2 (March 2, 2022)"
3821674,6.052657,https://api.reliefweb.int/v1/reports/3821674?appname=DESKTOP-06R1BSH,"Ukraine Crisis - Situation Report #1 (February 26, 2022)"
3830928,6.052657,https://api.reliefweb.int/v1/reports/3830928?appname=DESKTOP-06R1BSH,Bombs over Mariupol: Each day is like losing your whole life
3828553,6.052657,https://api.reliefweb.int/v1/reports/3828553?appname=DESKTOP-06R1BSH,Ukraine: Displaced twice by war and on the road again
3827031,6.052657,https://api.reliefweb.int/v1/reports/3827031?appname=DESKTOP-06R1BSH,Every day thousands of Ukrainians arrive in Slovakia - traumatised and exhausted
3826602,6.052657,https://api.reliefweb.int/v1/reports/3826602?appname=DESKTOP-06R1BSH,Thousands of people flee bombings in south Ukraine and head west
3826509,6.052657,https://api.reliefweb.int/v1/reports/3826509?appname=DESKTOP-06R1BSH,Ukraine: Health crisis in Mariupol
3826430,6.052657,https://api.reliefweb.int/v1/reports/3826430?appname=DESKTOP-06R1BSH,Russia: Detailed map of eastern Ukraine borderland (as of 8 March 2022)
3826425,6.052657,https://api.reliefweb.int/v1/reports/3826425?appname=DESKTOP-06R1BSH,Ukraine: Vynitsia Rapid map (as of 7 March 2022)
3826407,6.052657,https://api.reliefweb.int/v1/reports/3826407?appname=DESKTOP-06R1BSH,Ukraine: Vinnytska Oblast - Town of Vinnytsia with health facilities (as of 6 March 2022)
3826398,6.052657,https://api.reliefweb.int/v1/reports/3826398?appname=DESKTOP-06R1BSH,Ukraine: Lvivska Oblast - Town of Lviv with health facilities (as of 28 February 2022)
3826356,6.052657,https://api.reliefweb.int/v1/reports/3826356?appname=DESKTOP-06R1BSH,Ukraine: Urgent humanitarian race against time
3825578,6.052657,https://api.reliefweb.int/v1/reports/3825578?appname=DESKTOP-06R1BSH,Ukraine: Hospitals must not be attacked
3824747,6.052657,https://api.reliefweb.int/v1/reports/3824747?appname=DESKTOP-06R1BSH,Ukraine: “A race against time” in Odessa
3824287,6.052657,https://api.reliefweb.int/v1/reports/3824287?appname=DESKTOP-06R1BSH,"MSF's first international medical supplies arrive in Kyiv, Ukraine"
3823932,6.052657,https://api.reliefweb.int/v1/reports/3823932?appname=DESKTOP-06R1BSH,MSF staff report dire conditions in Mariupol - Call for safe passage of civilians
3823878,6.052657,https://api.reliefweb.int/v1/reports/3823878?appname=DESKTOP-06R1BSH,How MSF is responding to the crisis in Ukraine
3823845,6.052657,https://api.reliefweb.int/v1/reports/3823845?appname=DESKTOP-06R1BSH,MSF amplia su respuesta a la creciente crisis humanitaria en Ucrania y los países vecinos
3822517,6.052657,https://api.reliefweb.int/v1/reports/3822517?appname=DESKTOP-06R1BSH,MSF se mobilise en Ukraine et dans les pays limitrophes
