id,score,href,fields_title
3821683,6.0751762,https://api.reliefweb.int/v1/reports/3821683?appname=DESKTOP-06R1BSH,Ukraine: USG Response to Complex Emergency and 2022 Crisis Response (02/27/22)
3823440,6.0751762,https://api.reliefweb.int/v1/reports/3823440?appname=DESKTOP-06R1BSH,"Ukraine: UN expert condemns racist threats, xenophobia at border"
3823296,6.0751762,https://api.reliefweb.int/v1/reports/3823296?appname=DESKTOP-06R1BSH,People in need continues to support people in Ukraine
3823294,6.0751762,https://api.reliefweb.int/v1/reports/3823294?appname=DESKTOP-06R1BSH,"Ukraine: High Commissioner cites ""new and dangerous"" threats to human rights"
3823028,6.0751762,https://api.reliefweb.int/v1/reports/3823028?appname=DESKTOP-06R1BSH,"Le Ministre russe des affaires étrangères s’adresse au Conseil des droits de l’homme, où l’agression russe contre l’Ukraine est largement condamnée lors du débat de haut niveau"
3823016,6.0751762,https://api.reliefweb.int/v1/reports/3823016?appname=DESKTOP-06R1BSH,"On the Third Day of its High-level Segment, the Human Rights Council Hears Statements on Climate Change, the COVID-19 Pandemic, and Russia’s Aggression against Ukraine"
3822971,6.0751762,https://api.reliefweb.int/v1/reports/3822971?appname=DESKTOP-06R1BSH,Humanitarian train bridge between Ukraine and Prague launched with partners
3822949,6.0751762,https://api.reliefweb.int/v1/reports/3822949?appname=DESKTOP-06R1BSH,Save the Children raises crypto funds to support their Ukraine response
3827600,6.0751762,https://api.reliefweb.int/v1/reports/3827600?appname=DESKTOP-06R1BSH,"Ukraine - Complex Emergency Fact Sheet #6, Fiscal Year (FY) 2022"
3827568,6.0751762,https://api.reliefweb.int/v1/reports/3827568?appname=DESKTOP-06R1BSH,"Human Rights Council: Violence against children has increased due to the pandemic and multiple humanitarian crises, and 2021 posed unprecedented challenges for the protection of children living in conflict zones"
3831003,6.0751762,https://api.reliefweb.int/v1/reports/3831003?appname=DESKTOP-06R1BSH,"""The war has caused the fastest and largest displacement of people in Europe since World War II"" - Statement by Osnat Lubrani, UN Resident & Humanitarian Coordinator in Ukraine [EN/UK]"
3830563,6.0751762,https://api.reliefweb.int/v1/reports/3830563?appname=DESKTOP-06R1BSH,Update on the UN work in Ukraine 22.03.2022 [EN/UK]
3830522,6.0751762,https://api.reliefweb.int/v1/reports/3830522?appname=DESKTOP-06R1BSH,Ukraine: Civilian casualties as of 24.00 22 March 2022 [EN/RU/UK]
3828686,6.0751762,https://api.reliefweb.int/v1/reports/3828686?appname=DESKTOP-06R1BSH,Update on the UN work in Ukraine 17.03.2022 [EN/UK]
3828671,6.0751762,https://api.reliefweb.int/v1/reports/3828671?appname=DESKTOP-06R1BSH,Ukraine: Civilian casualties as of 24.00 16 March 2022 [EN/RU/UK]
3825680,6.0751762,https://api.reliefweb.int/v1/reports/3825680?appname=DESKTOP-06R1BSH,Ukraine: Statement in response to bombing of children's hospital
3825581,6.0751762,https://api.reliefweb.int/v1/reports/3825581?appname=DESKTOP-06R1BSH,"Gender, Health, and the War in Ukraine"
3825060,6.0751762,https://api.reliefweb.int/v1/reports/3825060?appname=DESKTOP-06R1BSH,Ukraine: USG Response to the Complex Emergency (03/08/22)
3824925,6.0751762,https://api.reliefweb.int/v1/reports/3824925?appname=DESKTOP-06R1BSH,49th session of the Human Rights Council Item 2: Annual Report and Oral Update by the High Commissioner for Human Rights on the activities of her Office and recent human rights developments: Statement by Michelle Bachelet
3829908,6.0751762,https://api.reliefweb.int/v1/reports/3829908?appname=DESKTOP-06R1BSH,Ukraine: Protection of LGBTI and gender-diverse refugees remains critical – UN expert
3829196,6.0751762,https://api.reliefweb.int/v1/reports/3829196?appname=DESKTOP-06R1BSH,Ukraine: Civilian casualties as of 24.00 19 March 2022 [EN/RU/UK]
3829094,6.0751762,https://api.reliefweb.int/v1/reports/3829094?appname=DESKTOP-06R1BSH,Ukraine: Civilian casualties as of 24.00 18 March 2022 [EN/RU/UK]
3829030,6.0751762,https://api.reliefweb.int/v1/reports/3829030?appname=DESKTOP-06R1BSH,Ukraine: USG Response to the Complex Emergency (03/18/22)
3829029,6.0751762,https://api.reliefweb.int/v1/reports/3829029?appname=DESKTOP-06R1BSH,"Ukraine - Complex Emergency Fact Sheet #7, Fiscal Year (FY) 2022"
3829022,6.0751762,https://api.reliefweb.int/v1/reports/3829022?appname=DESKTOP-06R1BSH,"Ukraine: UN expert warns of global famine, urges end to Russia aggression"
3828992,6.0751762,https://api.reliefweb.int/v1/reports/3828992?appname=DESKTOP-06R1BSH,"Statement of the United Nations Crisis Coordinator for Ukraine, 18 March 2022 [EN/UK]"
3824277,6.0751762,https://api.reliefweb.int/v1/reports/3824277?appname=DESKTOP-06R1BSH,"Calls for civilians to be protected as two children killed while fleeing Irpin, Ukraine"
3823944,6.0751762,https://api.reliefweb.int/v1/reports/3823944?appname=DESKTOP-06R1BSH,"Press release: Statement of the United Nations Crisis Coordinator for Ukraine, 5 March 2022 [EN/UK]"
3822384,6.0751762,https://api.reliefweb.int/v1/reports/3822384?appname=DESKTOP-06R1BSH,"Press briefing notes on Belarus, 01 March 2022 [EN/RU]"
3822120,6.0751762,https://api.reliefweb.int/v1/reports/3822120?appname=DESKTOP-06R1BSH,"Human Rights Council Hears from 21 Dignitaries as it Continues High-Level Segment, with Speakers Condemning Russia’s Military Aggression against Ukraine"
3822036,6.0751762,https://api.reliefweb.int/v1/reports/3822036?appname=DESKTOP-06R1BSH,UN experts call for end to Russian aggression against Ukraine and urgent protection of human rights [EN/RU]
3821934,6.0751762,https://api.reliefweb.int/v1/reports/3821934?appname=DESKTOP-06R1BSH,"Bachelet calls for strong leadership at moment of ""profound gravity"": 49th session of the Human Rights Council Opening Statement to the High Level Segment by Michelle Bachelet, UN High Commissioner for Human Rights [EN/RU]"
3821930,6.0751762,https://api.reliefweb.int/v1/reports/3821930?appname=DESKTOP-06R1BSH,"Human Rights Council Opens Forty-Ninth Session, Decides to Hold an Urgent Debate on Situation in Ukraine"
3826677,6.0751762,https://api.reliefweb.int/v1/reports/3826677?appname=DESKTOP-06R1BSH,Ukraine: Civilian casualties as of 24.00 13 March 2022 [EN/RU/UK]
3826673,6.0751762,https://api.reliefweb.int/v1/reports/3826673?appname=DESKTOP-06R1BSH,Acciones gubernamentales permiten refugio de familias ucranianas en Guatemala
3826599,6.0751762,https://api.reliefweb.int/v1/reports/3826599?appname=DESKTOP-06R1BSH,Ukraine: Civilian casualties as of 24.00 11 March 2022 [EN/RU/UK]
3826507,6.0751762,https://api.reliefweb.int/v1/reports/3826507?appname=DESKTOP-06R1BSH,"Ukraine - Complex Emergency Fact Sheet #5, Fiscal Year (FY) 2022"
3825790,6.0751762,https://api.reliefweb.int/v1/reports/3825790?appname=DESKTOP-06R1BSH,Afghan family in Ukraine forced to flee conflict for second time in eight months
3821280,6.0751762,https://api.reliefweb.int/v1/reports/3821280?appname=DESKTOP-06R1BSH,USAID deploys a disaster assistance response team to respond to humanitarian needs in Ukraine
3823334,6.0751762,https://api.reliefweb.int/v1/reports/3823334?appname=DESKTOP-06R1BSH,Turkish Red Crescent / Ukraine Crisis (03 Mar 2022)
3828673,6.0751762,https://api.reliefweb.int/v1/reports/3828673?appname=DESKTOP-06R1BSH,Mohammed bin Rashid orders airlift of emergency humanitarian aid to support civilians fleeing crisis in Ukraine
3825454,6.0751762,https://api.reliefweb.int/v1/reports/3825454?appname=DESKTOP-06R1BSH,Emerging Patterns of Civilian Harm in Ukraine
3823067,6.0751762,https://api.reliefweb.int/v1/reports/3823067?appname=DESKTOP-06R1BSH,General Assembly resolution demands end to Russian offensive in Ukraine [EN/AR/RU/ZH/SW/HI]
3821147,6.0751762,https://api.reliefweb.int/v1/reports/3821147?appname=DESKTOP-06R1BSH,Is Europe Prepared for a Possible Large-Scale Ukrainian Displacement Crisis?
3823436,6.0751762,https://api.reliefweb.int/v1/reports/3823436?appname=DESKTOP-06R1BSH,"Statement of ICC Prosecutor, Karim A.A. Khan QC, on the Situation in Ukraine: Receipt of Referrals from 39 States Parties and the Opening of an Investigation [EN/RU/UK]"
3822555,6.0751762,https://api.reliefweb.int/v1/reports/3822555?appname=DESKTOP-06R1BSH,"Statement of ICC Prosecutor, Karim A.A. Khan QC, on the Situation in Ukraine: “I have decided to proceed with opening an investigation.” [EN/RU/UK]"
3831056,6.0751762,https://api.reliefweb.int/v1/reports/3831056?appname=DESKTOP-06R1BSH,Update 31 - IAEA Director General Statement on Situation in Ukraine (24 March 2022)
3830575,6.0751762,https://api.reliefweb.int/v1/reports/3830575?appname=DESKTOP-06R1BSH,Update 30 - IAEA Director General Statement on Situation in Ukraine (23 March 2022)
3829655,6.0751762,https://api.reliefweb.int/v1/reports/3829655?appname=DESKTOP-06R1BSH,Update 28 – IAEA Director General Statement on Situation in Ukraine (21 March 2022)
3829222,6.0751762,https://api.reliefweb.int/v1/reports/3829222?appname=DESKTOP-06R1BSH,Update 27 – IAEA Director General Statement on Situation in Ukraine (20 March 2022)
3828144,6.0751762,https://api.reliefweb.int/v1/reports/3828144?appname=DESKTOP-06R1BSH,Update 23 - IAEA Director General Statement on Situation in Ukraine (16 March 2022)
3827524,6.0751762,https://api.reliefweb.int/v1/reports/3827524?appname=DESKTOP-06R1BSH,Update 22 - IAEA Director General Statement on Situation in Ukraine (15 March 2022)
3826715,6.0751762,https://api.reliefweb.int/v1/reports/3826715?appname=DESKTOP-06R1BSH,Update 20 – IAEA Director General Statement on Situation in Ukraine (13 March 2022) [EN/RU]
3826646,6.0751762,https://api.reliefweb.int/v1/reports/3826646?appname=DESKTOP-06R1BSH,Update 19 – IAEA Director General Statement on Situation in Ukraine (12 March 2022) [EN/RU]
3826048,6.0751762,https://api.reliefweb.int/v1/reports/3826048?appname=DESKTOP-06R1BSH,Update 17 - IAEA Director General Statement on Situation in Ukraine (10 March 2022) [EN/RU]
3823982,6.0751762,https://api.reliefweb.int/v1/reports/3823982?appname=DESKTOP-06R1BSH,Update 12 - IAEA Director General Statement on Situation in Ukraine (5 March 2022) [EN/RU]
3823867,6.0751762,https://api.reliefweb.int/v1/reports/3823867?appname=DESKTOP-06R1BSH,IAEA Director General Grossi’s Initiative to Travel to Ukraine [EN/RU]
3823728,6.0751762,https://api.reliefweb.int/v1/reports/3823728?appname=DESKTOP-06R1BSH,Update 9 - IAEA Director General Statement on Situation in Ukraine (3 March 2022) [EN/RU]
3823485,6.0751762,https://api.reliefweb.int/v1/reports/3823485?appname=DESKTOP-06R1BSH,Update 7 - IAEA Director General Statement on Situation in Ukraine (2 March 2022) [EN/RU]
3822992,6.0751762,https://api.reliefweb.int/v1/reports/3822992?appname=DESKTOP-06R1BSH,Update 6 - IAEA Director General Statement on Situation in Ukraine (2 March 2022) [EN/RU]
3822076,6.0751762,https://api.reliefweb.int/v1/reports/3822076?appname=DESKTOP-06R1BSH,Update 4 – IAEA Director General Statement on Situation in Ukraine (28 February 2022) [EN/RU]
3828596,6.0751762,https://api.reliefweb.int/v1/reports/3828596?appname=DESKTOP-06R1BSH,"More support urgently needed to assist people fleeing the war in Ukraine and countries of arrival, in particular the Republic of Moldova [EN/RU]"
3828592,6.0751762,https://api.reliefweb.int/v1/reports/3828592?appname=DESKTOP-06R1BSH,Psychological first aid for Ukrainian people [EN/FR/DE/HU/PL/RO/RU/SL/UK]
3829057,6.0751762,https://api.reliefweb.int/v1/reports/3829057?appname=DESKTOP-06R1BSH,"WFP Ukraine and Neighbouring Countries Situation Report #6, 18 March 2022"
3827315,6.0751762,https://api.reliefweb.int/v1/reports/3827315?appname=DESKTOP-06R1BSH,Ukraine adds to Yemen's woes as hunger emergency spreads and lack of funding leaves millions vulnerable [EN/AR]
3827305,6.0751762,https://api.reliefweb.int/v1/reports/3827305?appname=DESKTOP-06R1BSH,"WFP Ukraine and Neighbouring Countries Situation Report #5, 14 March 2022"
3826205,6.0751762,https://api.reliefweb.int/v1/reports/3826205?appname=DESKTOP-06R1BSH,Food security implications of the Ukraine conflict (March 2022)
3824704,6.0751762,https://api.reliefweb.int/v1/reports/3824704?appname=DESKTOP-06R1BSH,Integration of Ukrainian refugees: The road ahead
3824398,6.0751762,https://api.reliefweb.int/v1/reports/3824398?appname=DESKTOP-06R1BSH,"WFP Ukraine and Neighbouring Countries Situation Report #3, 7 March 2022"
3824286,6.0751762,https://api.reliefweb.int/v1/reports/3824286?appname=DESKTOP-06R1BSH,Implications of Ukraine Conflict on Food Access and Availability in the Eastern Africa Region
3823069,6.0751762,https://api.reliefweb.int/v1/reports/3823069?appname=DESKTOP-06R1BSH,Eastern Europe General Logistics Planning Map - February 2022
3823066,6.0751762,https://api.reliefweb.int/v1/reports/3823066?appname=DESKTOP-06R1BSH,"South-East Poland, General Logistics Planning Map - February 2022"
3834036,6.0751762,https://api.reliefweb.int/v1/reports/3834036?appname=DESKTOP-06R1BSH,EU preparedness to welcome those fleeing the war in Ukraine (23 March 2022)
3830365,6.0751762,https://api.reliefweb.int/v1/reports/3830365?appname=DESKTOP-06R1BSH,Ukraine: Commissioner Lenarčič visits Slovakia as EU continues emergency assistance
3827806,6.0751762,https://api.reliefweb.int/v1/reports/3827806?appname=DESKTOP-06R1BSH,Moldova - Population movement (DG ECHO) (ECHO Daily Flash of 16 March 2022)
3824036,6.0751762,https://api.reliefweb.int/v1/reports/3824036?appname=DESKTOP-06R1BSH,Ukraine - Humanitarian situation (DG ECHO partners) (ECHO Daily Flash of 06 March 2022)
3823012,6.0751762,https://api.reliefweb.int/v1/reports/3823012?appname=DESKTOP-06R1BSH,Ukraine Conflict | DG ECHO Response - DG ECHO Daily Map | 02/03/2022
3822084,6.0751762,https://api.reliefweb.int/v1/reports/3822084?appname=DESKTOP-06R1BSH,Ukraine | Assistance offered through the EU Civil Protection Mechanism – DG ECHO Daily Map | 28/02/2022
3822520,6.0751762,https://api.reliefweb.int/v1/reports/3822520?appname=DESKTOP-06R1BSH,"Security Council Report Monthly Forecast, March 2022"
3830236,6.0751762,https://api.reliefweb.int/v1/reports/3830236?appname=DESKTOP-06R1BSH,AMDA Emergency Relief #10: Crisis in Ukraine (23 March 2022)
3824701,6.0751762,https://api.reliefweb.int/v1/reports/3824701?appname=DESKTOP-06R1BSH,AMDA Emergency Relief #2: Crisis in Ukraine (08 March 2022)
3824280,6.0751762,https://api.reliefweb.int/v1/reports/3824280?appname=DESKTOP-06R1BSH,Switzerland steps up humanitarian aid for Ukraine
3829993,6.0751762,https://api.reliefweb.int/v1/reports/3829993?appname=DESKTOP-06R1BSH,Ukraine: Displacement Overview of Conflict Areas & Border Crossings - as of 21 March 2022 06:00 CET
3825388,6.0751762,https://api.reliefweb.int/v1/reports/3825388?appname=DESKTOP-06R1BSH,Ukraine Conflict Emergency Response - Situational Report #02 (March 2022)
3822412,6.0751762,https://api.reliefweb.int/v1/reports/3822412?appname=DESKTOP-06R1BSH,Finnish Red Cross sending its first aid workers to help people affected by the conflict in Ukraine
3821227,6.0751762,https://api.reliefweb.int/v1/reports/3821227?appname=DESKTOP-06R1BSH,Finnish Red Cross helps in the Ukraine conflict
3830460,6.0751762,https://api.reliefweb.int/v1/reports/3830460?appname=DESKTOP-06R1BSH,Slovakian cities with significant population change (03/14-03/20)
3830458,6.0751762,https://api.reliefweb.int/v1/reports/3830458?appname=DESKTOP-06R1BSH,Polish cities with significant population change (03/14-03/20)
3829018,6.0751762,https://api.reliefweb.int/v1/reports/3829018?appname=DESKTOP-06R1BSH,Romanian cities with significant population change (03/10-03/16)
3829009,6.0751762,https://api.reliefweb.int/v1/reports/3829009?appname=DESKTOP-06R1BSH,Romanian cities with significant population change (03/08-03/14)
3829006,6.0751762,https://api.reliefweb.int/v1/reports/3829006?appname=DESKTOP-06R1BSH,Hungarian cities with significant population change (03/08-03/14)
3829005,6.0751762,https://api.reliefweb.int/v1/reports/3829005?appname=DESKTOP-06R1BSH,Romanian cities with significant population change (03/07-03/13)
3829003,6.0751762,https://api.reliefweb.int/v1/reports/3829003?appname=DESKTOP-06R1BSH,Hungarian cities with significant population change (03/07-03/13)
3829002,6.0751762,https://api.reliefweb.int/v1/reports/3829002?appname=DESKTOP-06R1BSH,Slovakian cities with significant population change (03/02-03/08)
3829000,6.0751762,https://api.reliefweb.int/v1/reports/3829000?appname=DESKTOP-06R1BSH,Polish cities with significant population change (03/02-03/08)
3828999,6.0751762,https://api.reliefweb.int/v1/reports/3828999?appname=DESKTOP-06R1BSH,Social connectedness with Ukraine & population change in adjacent countries (03/02-03/08)
3828995,6.0751762,https://api.reliefweb.int/v1/reports/3828995?appname=DESKTOP-06R1BSH,Romanian cities with significant population change (03/01-03/06)
3828994,6.0751762,https://api.reliefweb.int/v1/reports/3828994?appname=DESKTOP-06R1BSH,Polish cities with significant population change (03/01-03/06)
3828969,6.0751762,https://api.reliefweb.int/v1/reports/3828969?appname=DESKTOP-06R1BSH,"Population Movement & Refugee Reception Points Along Poland-Ukraine Border by Feb. 26, 16:00-23:59 local time"
3829199,6.0751762,https://api.reliefweb.int/v1/reports/3829199?appname=DESKTOP-06R1BSH,Questions & Answers on Explosive Ordnance Risk Education (EORE) for Ukraine [EN/RU/UK]
3821085,6.0751762,https://api.reliefweb.int/v1/reports/3821085?appname=DESKTOP-06R1BSH,UK for UNHCR launches urgent Ukraine Emergency appeal
3831002,6.0751762,https://api.reliefweb.int/v1/reports/3831002?appname=DESKTOP-06R1BSH,A Tentative First Look at Options for Peace Operations in Ukraine
3828068,6.0751762,https://api.reliefweb.int/v1/reports/3828068?appname=DESKTOP-06R1BSH,Mitigating the Gendered Effects of Ukraine’s Refugee Crisis
3822970,6.0751762,https://api.reliefweb.int/v1/reports/3822970?appname=DESKTOP-06R1BSH,CrisisWatch February 2022
3825772,6.0751762,https://api.reliefweb.int/v1/reports/3825772?appname=DESKTOP-06R1BSH,Russia’s Bombing of Ukrainian Hospitals Directly Violates Geneva Conventions: PHR
3823443,6.0751762,https://api.reliefweb.int/v1/reports/3823443?appname=DESKTOP-06R1BSH,"Russia Must Cease Hostilities, Violations of International Law in Ukraine: PHR"
3826607,6.0751762,https://api.reliefweb.int/v1/reports/3826607?appname=DESKTOP-06R1BSH,Ukraine Crisis Situation Update 02 (12 March 2022)
3821387,6.0751762,https://api.reliefweb.int/v1/reports/3821387?appname=DESKTOP-06R1BSH,MOAS Launches Humanitarian Relief Effort for Ukraine
3829561,6.0751762,https://api.reliefweb.int/v1/reports/3829561?appname=DESKTOP-06R1BSH,Red Cross research reveals ‘huge outpouring of solidarity’ with refugees ahead of crucial week for asylum reforms
3830086,6.0751762,https://api.reliefweb.int/v1/reports/3830086?appname=DESKTOP-06R1BSH,La France accueille les premiers enfants malades venus d'Ukraine
3825259,6.0751762,https://api.reliefweb.int/v1/reports/3825259?appname=DESKTOP-06R1BSH,"Ukraine: Salesian missionaries provide shelter, education and aid to refugees"
3823042,6.0751762,https://api.reliefweb.int/v1/reports/3823042?appname=DESKTOP-06R1BSH,Ukraine: Salesian Missions launches emergency appeal to aid refugees
3829882,6.0751762,https://api.reliefweb.int/v1/reports/3829882?appname=DESKTOP-06R1BSH,Flash Update: Humanitarian Impact of Ukraine Conflict on Lebanon - March 2022
3830937,6.0751762,https://api.reliefweb.int/v1/reports/3830937?appname=DESKTOP-06R1BSH,WHO Director-General's Keynote address at the World TB Day Online Talk Show - 24 March 2022
3830562,6.0751762,https://api.reliefweb.int/v1/reports/3830562?appname=DESKTOP-06R1BSH,WHO Director-General's opening remarks at the WHO press conference - 23 March 2022
3830206,6.0751762,https://api.reliefweb.int/v1/reports/3830206?appname=DESKTOP-06R1BSH,Poland: Understanding the mental health and psychosocial needs of Ukraine’s refugees – Olga’s story [EN/RU]
3828590,6.0751762,https://api.reliefweb.int/v1/reports/3828590?appname=DESKTOP-06R1BSH,WHO Director-General's remarks at United Nations Security Council meeting on Ukraine – 17 March 2022 [EN/AR/RU]
3828574,6.0751762,https://api.reliefweb.int/v1/reports/3828574?appname=DESKTOP-06R1BSH,"Emergency in Ukraine: External Situation Report #3, published 17 March 2022"
3828056,6.0751762,https://api.reliefweb.int/v1/reports/3828056?appname=DESKTOP-06R1BSH,WHO Director-General's opening remarks at the WHO press conference - 16 March 2022
3825208,6.0751762,https://api.reliefweb.int/v1/reports/3825208?appname=DESKTOP-06R1BSH,"Ukraine: Running for their lives, without even a toothbrush"
3823996,6.0751762,https://api.reliefweb.int/v1/reports/3823996?appname=DESKTOP-06R1BSH,"Emergency in Ukraine: External Situation Report #1, published 5 March 2022"
3822958,6.0751762,https://api.reliefweb.int/v1/reports/3822958?appname=DESKTOP-06R1BSH,WHO Director-General's opening remarks at the media briefing on COVID-19 - 2 March 2022
3822745,6.0751762,https://api.reliefweb.int/v1/reports/3822745?appname=DESKTOP-06R1BSH,Running a hospital at a desperate time - a story from Western Ukraine [EN/RU]
3823261,6.0751762,https://api.reliefweb.int/v1/reports/3823261?appname=DESKTOP-06R1BSH,The impact of conflict in Ukraine on global food security [EN/AR]
3823808,6.0751762,https://api.reliefweb.int/v1/reports/3823808?appname=DESKTOP-06R1BSH,Health Partners International of Canada launches Ukraine Response with first deployment of Emergency Humanitarian Medical Kits
3825915,6.0751762,https://api.reliefweb.int/v1/reports/3825915?appname=DESKTOP-06R1BSH,Ukraine’s Regional Displacement Crisis
3824671,6.0751762,https://api.reliefweb.int/v1/reports/3824671?appname=DESKTOP-06R1BSH,International Women’s Day: Serving Refugees from Ukraine
3821522,6.0751762,https://api.reliefweb.int/v1/reports/3821522?appname=DESKTOP-06R1BSH,Water Mission Mobilizes Disaster Response Assessment Team to Ukraine
3822962,6.0751762,https://api.reliefweb.int/v1/reports/3822962?appname=DESKTOP-06R1BSH,PallCHASE Statement on the Humanitarian Crisis in Ukraine
3824768,6.0751762,https://api.reliefweb.int/v1/reports/3824768?appname=DESKTOP-06R1BSH,"As over 1.5 million people flee Ukraine, women and children at increased risk of exploitation and abuse, warns IRC"
3822119,6.0751762,https://api.reliefweb.int/v1/reports/3822119?appname=DESKTOP-06R1BSH,IRC calls for adherence to international humanitarian law as civilians are killed and infrastructure is destroyed in Ukraine
3821293,6.0751762,https://api.reliefweb.int/v1/reports/3821293?appname=DESKTOP-06R1BSH,"As Russia invades Ukraine and civilians desperately seek safety, IRC prepares for the worst and calls for the protection of civilians to avert grave human suffering"
3822806,6.0751762,https://api.reliefweb.int/v1/reports/3822806?appname=DESKTOP-06R1BSH,Statement: Russian War Crimes in Ukraine
3820889,6.0751762,https://api.reliefweb.int/v1/reports/3820889?appname=DESKTOP-06R1BSH,Refugees International Warns of Displacement and Suffering in Russia’s War with Ukraine
3828665,6.0751762,https://api.reliefweb.int/v1/reports/3828665?appname=DESKTOP-06R1BSH,War in Ukraine: Emergency Support for Displaced Populations
3833724,6.0751762,https://api.reliefweb.int/v1/reports/3833724?appname=DESKTOP-06R1BSH,Guerre en Ukraine: la CRS débloque 10 mio de CHF et demande un accueil sans complications
3833713,6.0751762,https://api.reliefweb.int/v1/reports/3833713?appname=DESKTOP-06R1BSH,Statut de protection S pour les réfugiés d’Ukraine: la CRS demande une approche axée sur l’intégration
3831004,6.0751762,https://api.reliefweb.int/v1/reports/3831004?appname=DESKTOP-06R1BSH,ICRC President completes visit to Russia to speak about humanitarian issues in armed conflict [EN/RU]
3828520,6.0751762,https://api.reliefweb.int/v1/reports/3828520?appname=DESKTOP-06R1BSH,Ukraine: ICRC president visits Ukraine and appeals to the parties to take steps to alleviate suffering
3828513,6.0751762,https://api.reliefweb.int/v1/reports/3828513?appname=DESKTOP-06R1BSH,ICRC Humanitarian Law & Policy blog : Armed conflict in Ukraine: a recap of basic IHL rules
3828452,6.0751762,https://api.reliefweb.int/v1/reports/3828452?appname=DESKTOP-06R1BSH,ICRC President: The suffering in Mariupol must not become the future of Ukraine [EN/RU]
3825017,6.0751762,https://api.reliefweb.int/v1/reports/3825017?appname=DESKTOP-06R1BSH,"- UPDATED 8th March - Ukraine: Despite fierce fighting raging, the ICRC responds to the most urgent needs in Mariupol"
3823941,6.0751762,https://api.reliefweb.int/v1/reports/3823941?appname=DESKTOP-06R1BSH,Statement on safe passage operations in Ukraine [EN/RU]
3823219,6.0751762,https://api.reliefweb.int/v1/reports/3823219?appname=DESKTOP-06R1BSH,Useful information for people affected by the crisis in Ukraine [EN/RU/UK]
3821052,6.0751762,https://api.reliefweb.int/v1/reports/3821052?appname=DESKTOP-06R1BSH,Statement from ICRC President Peter Maurer on the conflict in Ukraine [EN/RU]
3828842,6.0751762,https://api.reliefweb.int/v1/reports/3828842?appname=DESKTOP-06R1BSH,"Ukrainian Red Cross has helped over 300,000 people during the humanitarian crisis"
3828781,6.0751762,https://api.reliefweb.int/v1/reports/3828781?appname=DESKTOP-06R1BSH,Helping the casualties with state emergency service of Ukraine [EN/UK]
3828776,6.0751762,https://api.reliefweb.int/v1/reports/3828776?appname=DESKTOP-06R1BSH,Helping in Lutsk [EN/UK]
3827557,6.0751762,https://api.reliefweb.int/v1/reports/3827557?appname=DESKTOP-06R1BSH,Evacuating people from boarding house in Mykolaiv
3821207,6.0751762,https://api.reliefweb.int/v1/reports/3821207?appname=DESKTOP-06R1BSH,Singapore Red Cross Supports Communities Affected by Ukraine Conflict
3830391,6.0751762,https://api.reliefweb.int/v1/reports/3830391?appname=DESKTOP-06R1BSH,Le Fonds mondial appelle à un regain d’urgence dans la lutte contre la tuberculose
